source,filename,text,length,timestamp,url
Reach areas with low user demand (current and/or projected)
The revenue-generating potential of EV charging points varies greatly from place to place (for example
inner-city zones vs. rural areas). Market forces alone will drive private sector parties towards installing
EV charging infrastructure in areas with opportunities for higher, faster and safer investment returns.
In some places, the problem might be slow EV uptake, meaning that charging points are not yet
profitable but will become so over time. In other places, the problem might be low population density,
meaning there will never be enough demand to make charging points profitable. Each partnering
model has scope to deliver EV charging infrastructure in areas the market would otherwise ignore.
The public contract and availability-based models are simplest to negotiate and implement in
this respect. The public authority identifies locations needing investment and the private partner is
contractually obliged to install the infrastructure in those areas. The public authority bears user-demand
risk and is obliged to pay the private partner9 irrespective of the profitability of charging points.
Under the concession and licence models, where the private partner bears user-demand risk,
unprofitable (or less profitable) locations need to be bundled with more profitable locations to ensure
the private partner will make a reasonable return on its investment within a reasonable timeframe.10
However, for a public authority, the “hands-off” nature of a licence arrangement gives limited assurance
of the private partner delivering and sustaining the desired investment and operation in unprofitable
locations over time. By contrast, through various contractual mechanisms, the concession model gives
the public authority much more control over delivery of the EV charging infrastructure investment and
the long-term availability and performance of the investment (see objectives 1, 2 and 3 above).
9 The public authority pays on installation under the public contract model or through regular availability payments under the availability-based model
10 In the concession model, the authority could alternatively provide some form of support (e.g. subsidies or guarantees) to mitigate the risk that unprofitable locations
pose to the private partner.
PART 1: DECIDING TO USE A CONCESSION MODEL14
The joint venture model could incorporate a remit to reach areas with various levels of demand and
profitability. However, compared to other partnering models, a joint venture is more likely to give the
public authority less control and certainty on reaching and servicing unprofitable areas.
Objective 5
Create and/or maintain a competitive market for EV charging that drives fair prices for users
A central message of most strategies promoting EV uptake is the low running costs of EVs compared to
internal combustion engine vehicles. For this reason, a public authority will want to ensure that prices
are fair and reasonable for users.
Primarily, this requires the public authority to run a robust and efficient procurement process that
drives healthy competition among those bidding for the contract. To back this up, the public authority
could use contractual provisions to ensure fair and reasonable prices for users. With no such controls, a
dominant market player might emerge (at street/area/city level, for instance), with freedom to charge
users unreasonably high prices. Price controls also allow a public authority to maintain price parity
across different locations.
In the public contract and availability-based models, the public authority controls the operation of
the infrastructure and keeps the revenues it generates. It therefore has complete freedom to determine
the prices charged to users.
The concession model allows a public authority to fix or cap (or otherwise regulate) pricing in the
contract. However, as the private partner must generate enough user revenues to profit from its
investment, the public authority should consider how contractual price controls might affect the
private partner’s willingness to bear user-demand risk. Depending on the private partner’s assessment
of user-demand risk when bidding for the concession, it might seek support (such as guarantees or
subsidies) from the public authority to mitigate that risk if price adjustments are constrained.
The licence model typically gives the public authority limited (if any) control over pricing, which is
instead managed either naturally through competition or, in some cases, by a public regulator.
Arrangements in the joint venture model could be structured with any level of control over pricing.
As in the concession model, however, private sector participation in the venture will depend on its
assessment of risk and ability to make a return.
Objective 6
Integrate EV charging within a wider eco-mobility strategy
Increasing the number of EV charging points is usually just one element of a public authority’s wider
eco-mobility strategy. Other elements might include subsidies to purchase EVs or a ban on diesel
vehicles in inner-city areas. A public authority should be mindful of the interactions between individual
elements of its strategy, and of the limitations of different partnering models in accommodating
strategy changes over time.
ELECTRIC VEHICLE CHARGING CONCESSIONS: A CONTRACT GUIDE FOR PUBLIC AUTHORITIES15
Changes to EV charging infrastructure
A change or development in overall strategy might prompt the public authority to seek to change the
EV charging infrastructure and/or systems after signing the contract (e.g. to switch to fast chargers,
integrate the user interface with a city-wide system/app, or concentrate charging points in hub areas).
In the licence model, the public authority usually has no right to instruct the private partner to change
the EV charging infrastructure or service. Under the public contract model, by contrast, the public
authority is free to alter the infrastructure or service at its own cost. Similarly, the public authority is
usually free to instruct changes under the concession or availability-based model, although the
complex nature of these models can often make such changes difficult and costly to negotiate. In
the joint venture model, changes to the EV charging infrastructure or service will typically be a joint
decision, with the costs shared according to the parties’ stakes in the arrangement.
Changes to other elements of the eco-mobility strategy
Under the licence model, the private partner bears the risk of how other elements of the strategy
impact the performance or profitability of the EV charging infrastructure (lower user revenues, for
instance, because the public authority decides not to implement a ban on diesel vehicles). In the
concession model, however, it is more common for the private partner to seek guarantees from the
public authority on the implementation of other strategy elements (such as the EV subsidy scheme
continuing for a minimum period). Under the public contract and availability-based models, the
interaction between the EV charging infrastructure’s performance and profitability and other strategy
elements is borne by the public authority.
Objective 7
Use private sector capital and minimise the impact on public finances
Except for the public contract model, which relies on public authority financing, all the partnering
models provide an opportunity to deploy private sector capital. This reduces the need for the public
authority to commit financial resources to upfront investment in EV charging infrastructure.
In the licence or concession model, the private partner makes the upfront investment in the EV
charging infrastructure. If demand will likely exceed the level required to generate a reasonable
return over a reasonable timeframe, the public authority might even demand a fee or share of the
revenues, in return for granting the licence or concession (thus impacting positively on public finances).
Conversely, if demand is unlikely to be sufficient, a licence or concession might only be viable if the
public authority agrees to provide financial support (such as a guarantee or subsidy).
Likewise, in the availability-based model, the private partner makes the upfront investment. However,
this model requires the public authority to pay periodic fees that cover repayment of the investment
over the contract duration and to bear the risk of user revenues proving insufficient to cover those
fees. The availability-based model can be structured to allow the public authority to contribute some
capital to the upfront investment, thereby reducing the size of periodic fees. A public authority might
choose to do this if, for example, it receives a lump-sum grant from a national authority, ring-fenced for
this purpose.
The financing and funding arrangements of the joint venture model can be structured according to
the parties’ particular resources, objectives, and constraints.
PART 1: DECIDING TO USE A CONCESSION MODEL16
Objective 8
Deploy private sector expertise and resources
Limited expertise and resources within a public authority might influence its choice of a partnering
model.
The public contract model typically requires more technical know-how and expertise from the
public authority, which needs to understand and define its technical and service requirements in very
prescriptive “input” terms. By contrast, the concession and availability-based models tend to specify
requirements in “output” terms, requiring the public authority to define the outcomes or outputs it
expects but not the inputs needed to achieve them.11
The licence model is the least demanding on public authority expertise and resources, leaving the
private partner largely free to design, install and operate EV charging infrastructure as it chooses,
within only limited constraints.
The joint venture model allows the public authority to draw in whatever type and level of private
sector resources and expertise it needs. However, the success of this partnering model relies heavily
on the public authority’s ability to drive the joint venture towards its founding objectives. The public
authority therefore requires specific expertise to continually manage the private partner, in addition to
a good understanding of EV business models.
Conclusion
Choosing a partnering model
The public authority’s assessment of how the various models align with its objectives, and ultimately
its selection of a partnering model, will take account of a range of financial (quantitative) and non-
financial (qualitative) factors including (but not limited to):
• costs of installation, maintenance and operation; forecast utilisation; envisaged tariff structure;
• availability of public finances and the implications of the various partnering models under rules for
budgeting, accounting and statistical treatment (Eurostat);12
• market capacity (skills and resources) and appetite (interest, understanding, attitude to risk and
investment size) to deliver what the partnering models require;
• public authority capacity (skills and resources) and appetite (interest) to procure and deliver
what the partnering models demand, in terms of legal obligations and ongoing monitoring and
management needs;
11 In any of these three models, cooperation at a regional and/or national level allows public authority expertise to be shared or aggregated.
12 Budgeting and accounting rules apply at the level of the relevant public authority, governing how the authority budgets and accounts for expenditure and income
under the partnering model. Statistical treatment rules apply at the level of national government, governing how expenditure and income under the partnering
model affects national debt and deficit figures.
ELECTRIC VEHICLE CHARGING CONCESSIONS: A CONTRACT GUIDE FOR PUBLIC AUTHORITIES17
• the public authority’s preferred level of influence over the development and performance of the
public EV charging infrastructure network (such as service quality, pricing, spatial development,
market organisation);
• impact on the shape, size and competitiveness of the EV charging market (for example, risk of
crowding-out or deterring new entrants);
• flexibility of the various partnering models to adapt to changes in laws, policies and/or regulations;
• requirements and restrictions of relevant laws and regulations (for instance, relating to public
contracts);
• estimated time to procure a contract and roll out the EV charging infrastructure under the various
partnering models.
The choice of partnering model requires complex analyses and decision-making. The public authority
will need to follow a process that ultimately enables a robust “value for money” judgment on the best
use of public resources.
PART 1: DECIDING TO USE A CONCESSION MODELStructure and content of
the concession contract2
PPAARRTT 2
Structure and content of
the concession contract2211
Structure and content of the concession contract
The public authority will start to prepare the concession contract after:
• defining the scope of the EV infrastructure procurement;13
• determining that a concession is the optimal partnering model.
Part 2 of the guide is structured around 13 contract themes and explains the typical features of a
concession arrangement for public EV charging infrastructure. It explores the risks and issues
associated with each theme and how these are approached in the concession contract. The public
authority objectives mentioned in these themes are typically those described in Part 1 of this guide.
For some themes, the guide suggests some public authority support measures that, depending on
the circumstances, might be appropriate or even necessary to enhance or address concerns about the
concession’s viability or deliverability.
Building on the description in Part 1 of this guide, Part 2 assumes that an EV charging infrastructure
concession is an arrangement between a public authority and a private partner in which:
• the private partner is responsible for installing, maintaining and operating publicly available EV
charging infrastructure for a defined time period;
• the private partner provides some (or all) of the financing required to design, purchase, install,
operate and maintain the EV charging infrastructure;
• the private partner has a direct relationship with users and collects and retains revenues from
them;
• the private partner’s revenues fluctuate according to user demand and/or the standard to which it
performs its obligations.
The success of a concession contract in meeting a public authority’s objectives will depend
on not only the content of the concession contract (this guide’s focus) but also the public
authority’s commitment to managing the contract’s implementation. Throughout
the contract, the public authority needs to allocate appropriate time and resources to
monitoring the private partner’s performance and enforcing the contractual terms to realise
the full value and opportunity of the concession arrangement.
13 The precise definition of EV charging infrastructure depends on the scope of the private partner’s obligations (see footnote 4). It can include any or all of the following:
grid upgrades; grid connections; charging points; systems, devices, applications and components for the user interface. The viability of the scope of an EV concession
contract should be tested with the market in advance of procurement.
PART 2: STRUCTURE AND CONTENT OF THE CONCESSION CONTRACT22
Theme 1
Duration
The contract should clearly state the duration of the arrangement and any process for its renewal or
extension. In setting the contract duration, the public authority will be mindful of:
• the period of time needed for the private partner to recover its investment and make a
reasonable return;
• the amount of public funds available to support the concession if required (e.g. shorter duration
might increase the need for public support);
• the likelihood of shifts in the EV market and/or technology (avoiding being locked into long-term
contracts for redundant infrastructure);
• whether the underlying objectives are short-term (e.g. testing or demonstrating a concept) or
long-term (e.g. creating a large-scale public service);
• maintaining a healthy and competitive market (avoiding overly long contracts with single
providers, particularly if exclusivity is granted);
• legal restrictions;14
• time and resources needed to prepare and run procurements for future concessions (i.e. how often
the public authority wants to undertake this exercise);
• interfaces with any other relevant contracts.
The contract typically distinguishes between an installation period, within which the private partner
must install the public EV charging infrastructure, and an exploitation period, during which the
private partner is entitled to operate and receive income from the EV charging infrastructure. In many
contracts, these two periods will overlap, enabling the private partner to start generating revenues
from the first charging points it installs while continuing to install further charging points.
Contracts often give the private partner exclusivity over installing EV charging points on public land
during the installation period.
14 One example is laws implementing Directive 2014/23/EU, particularly Article 18, which states that a concession’s duration should not exceed the time needed to
recover the investment made and a return thereon.
ELECTRIC VEHICLE CHARGING CONCESSIONS: A CONTRACT GUIDE FOR PUBLIC AUTHORITIES2233
Theme 2
Sites
Selecting sites
The contract will identify sites for installation of the EV charging infrastructure, and/or potential sites
where the private partner is expected to develop the network in response to projected or actual
demand arising during the contract.
These sites might be selected by the public authority before procurement, based on an assessment of
how best to meet its objectives (network coverage and balance, for instance) within any constraints
(such as available land or planning conditions). The public authority might invite bidders to propose
additional or alternative sites during the procurement process. if accepted by the public authority,
these sites are then included in the contract. The contract itself can also offer flexibility for the private
partner to propose additional or alternative sites during the installation period. Some contracts even
financially incentivise the private partner to minimise use of public land and instead find alternative
private sites that still meet public demand. For instance, a private partner able to do this might pay
reduced concession fees to the public authority. The public authority’s approval is usually required for
changes to sites specified in the contract.
Ownership and access
The public authority typically retains ownership of the sites and, in the contract, grants rights of access
to the private partner for installing, maintaining and operating the EV charging infrastructure on those
sites. Conversely, the contract will make the private partner responsible for arranging whatever access
rights it needs for any proposed alternative sites not owned by the public authority.
Site conditions
Many contracts are silent about the suitability or condition of the sites, which implies that the private
partner bears the risk and responsibility for any difficulty, delay or cost caused by unexpected site
conditions (such as contamination). In practice, adverse ground conditions are unlikely to cause
problems for the installation and operation of most public EV charging infrastructure, which will
typically be located at the roadside. Looking at PPP practice in other sectors, there are some support
measures that the public authority might consider taking in relation to site conditions. These include, in
increasing order of supportiveness:
• disclosing to bidders, during the procurement, any site surveys undertaken by the public authority;
• guaranteeing the accuracy and/or completeness of such surveys;
• if sites cannot be surveyed before contract award, including a contractual provision allowing the
private partner to claim relief and/or compensation if it encounters any adverse site conditions (see
Theme 10).
The extent to which these types of measures are necessary or appropriate to enhance competition and
drive a better value solution for users will depend on the project’s specific circumstances. These include
the amount of publicly available information; the level of interest from potential bidders; the cost, time
and disruption of multiple surveys; and issues encountered on previous projects in the area.
PART 2: STRUCTURE AND CONTENT OF THE CONCESSION CONTRACT24
Theme 3
Design and installation of EV charging infrastructure
Overall approach
The conventional approach to design and installation of EV charging infrastructure includes the
following elements:
• Technical specifications: the private partner is required to design and install EV charging
infrastructure that meets the public authority’s technical specifications for the hardware (for
example, user-friendly design of charging points, signage, spatial integration, grid connections,
hardware interoperability) and software (such as metering requirements, remote connectivity,
system interoperability, cybersecurity). The specifications will likely refer to other industry design
standards and specifications, as well as relevant laws and regulations (see Theme 9).
• Process: the contract might specify procedures the private partner must follow during the
installation phase. For instance, if the contract requires installation in response to user demand, it
may set a particular procedure from receipt of a user application through to site identification and
finally completion of the installation.
• Permits and authorisations: the private partner is obliged to obtain all permits and authorisations
necessary for installing and operating the EV charging infrastructure (such as planning consent).
• Grid connections (new): where any new grid connection is required, the private partner is
responsible for securing agreement with the grid operator and for the time and cost of the
connection works.
• Grid connections (existing): if the private partner is taking over an existing grid connection, it is
responsible for transferring the existing agreement.
• Programme: the private partner is required to meet certain deadlines in the installation phase. For
instance, the contract may stipulate the installation of [x] charging points at [specific locations] or
the achievement of [kWh] of available charging capacity by [date], or require the installation of a
charging point within [y] months of a user application.15 The opportunity to start generating user
revenues creates a natural incentive for the private partner to install the EV charging infrastructure
quickly. However, the public authority will have a programme in mind for implementing the
project and achieving its underlying objectives. Setting deadlines in the contract will increase the
certainty of meeting these aims. Failure by the private partner to meet these deadlines should lead
to penalties appropriate to the project’s scale and market practice in the sector (e.g. liquidated
damages) and/or ultimately to the contract’s ea rly termination (see Theme 12).
• Approval: before the private partner starts work, the public authority often has the contractual
right to review and approve the design of the EV charging infrastructure (hardware and software),
design of the network (the final positioning of individual stations relative to one another) and
the installation programme. Thereafter, the public authority will reserve the right to approve any
changes to these.
15 Obligations in the installation programme will depend on the underlying strategy for developing the EV charging network — see footnote 4 above.
ELECTRIC VEHICLE CHARGING CONCESSIONS: A CONTRACT GUIDE FOR PUBLIC AUTHORITIES2255
• Health & safety: the private partner is responsible for complying with all relevant health and safety
laws, regulations and good practice.
• Monitoring: the public authority typically has the right to monitor the installation’s progress and its
compliance with the technical specifications and requirements.
Exceptions
The time and cost of designing and installing the EV charging infrastructure under the approach
described above are the private partner’s risk and responsibility. Nevertheless, contracts often contain
exceptions allowing the private partner to claim relief and/or compensation from the public authority
(see Theme 10). Some contracts create a general exception, such as for any circumstances beyond the
private partner’s control. However, best practice is for the contract to list a limited number of specific
exceptions. This creates much more certainty for both parties and is particularly recommended for
exceptions with a direct financial impact on the public authority (when compensation is payable).
Theme 10 provides further guidance on these exceptions and the mechanisms through which they can
be applied.
Additional support measures
The public authority might also consider additional measures to support the design and installation of
the EV charging infrastructure, such as:
• ensuring its planning and permitting regime supports the installation of EV charging points.
This does not form part of the contract but will affect the market’s appetite for and approach to
the concession arrangement;
• undertaking in the contract to cooperate and facilitate the private partner’s applications for permits
and authorisations;
• using regional, national and/or other known industry standards and specifications, with which the
market is familiar;
