source,filename,text,length,timestamp,url
42inspection of electrical connections and the physical condition of charging
points.
● Risk Assessments: Recommends conducting detailed risk assessments
that consider the specific hazards associated with EV charging in covered
car parks. These assessments should inform the design, operation, and
emergency planning for car parks to ensure a comprehensive approach to
fire safety.
433. Key challenges related to fire safety of
BEVs in covered parking lots
In the rapidly evolving world of BEVs, fire safety in covered parking facilities has
become a critical concern. While fires pose risks in any context, the unique
characteristics of BEVs require a nuanced understanding of the potential
hazards. This chapter highlights the key challenges associated with fire safety in
covered parking lots for BEVs. By exploring these issues, it aims to provide
valuable insights for public authorities and private stakeholders to consider when
evaluating changes to guidelines, legislation, or safety practices. The discussion
underscores the importance of a comprehensive approach to fire safety in light
of the growing adoption of BEVs, fostering a safer environment for both users
and emergency responders.
3.1. Fire safety challenges linked to the lithium-ion
BEVs
3.1.1. Types of potential dangerous phenomena
The current fire safety requirements for BEVs are inadequate to significantly
reduce the likelihood of hazardous events.27 Furthermore, lithium-ion batteries in
BEVs pose several risks, including thermal runaway, fires, jet fires, and vapor-
cloud explosion (VCE), along with the potential for reignition or delayed ignition.
The following sections in this chapter will outline and describe each of these risks.
It is worth noting, however, that while these risks associated with battery packs
exist, data from the Nederlands Instituut Publieke Veiligheid (NIPV) shows that
nearly half of electric vehicle fires do not involve the battery packs.28
Thermal runaway is one of the primary risks associated with lithium-ion batteries.
It occurs when a lithium-ion cell enters an uncontrollable, self-heating state
through an exothermic reaction. This phenomenon begins within the battery cells,
leading to their decomposition and potentially resulting in thermal propagation
within the battery pack. This process can continue with the release of gas and
smoke and may ultimately escalate to a fire.
A battery pack consists of numerous cells, each separated by a critical
component called the separator, which isolates the anode (-) from the cathode
(+). Thermal runaway can be triggered by a defect in a cell’s separator, often
caused by physical, thermal, or electrical abuse. Once initiated, thermal runaway
involves a rapid overheating event where elevated temperatures or excessive
27 (Troitzsch, 2022)
28 (NIPV Annual Report 2022, 2023)
44voltage initiate chemical reactions within the battery cell. If the battery’s cooling
system is overwhelmed, ignition can occur. This ignition can, in turn, heat
adjacent cells, leading to thermal propagation.
The more cells affected by thermal runaway within a battery pack, the greater the
likelihood of a fire spreading through successive cells. This chain reaction can
ultimately result in the failure of the entire battery pack.
Diagram of thermal runaway, Euralarm
Thermal runaway can sometimes begin at relatively low temperatures
(approximately 90–120°C), often as a result of overcharging. The temperature
rises rapidly as the failing battery releases flammable gases, which can ignite in
the presence of an ignition source or if the surrounding environment provides the
necessary conditions for combustion—namely sufficient oxygen generation, a
fuel source, and heat. A fully charged battery experiencing thermal runaway
generates a significant amount of heat and gas that may ignite when vented from
the battery cell. Short circuits can further contribute to ignition. However, if the
battery is discharged or has a low charge level, there may be insufficient energy
in the cell to heat the released gas to its ignition point, allowing the gas to vent
without igniting.29
Beyond mechanical damage or external thermal abuse, thermal runaway usually
occurs when the Battery Management System (BMS) fails to implement
countermeasures to address battery issues such as overheating. This can lead
to a range of reactions, including fires and explosions of released gases, with
potentially severe consequences in confined spaces. Several scenarios are
possible:
29 (Guidelines for Fire and Rescue Services: Risk Assessment and Handling of Fire in Lithium-
Ion Batteries, 2021)
45● Free-burning fire: Flammable gases ignite when exposed to an ignition
source, such as hot metallic particles inside the battery pack.
● Jet fire: Gases vent with momentum, producing directional flames, often
designed to escape from the side of a vehicle to reduce overpressure.
● Flash fire: Vented gases mix with air within their flammability range,
resulting in a deflagration (a rapid combustion event below the speed of
sound) that may quickly consume all available vapor without igniting other
materials.
● Vapor cloud explosion (VCE): A cloud of flammable gases forms and
explodes if ignited under conditions of sufficient confinement.
Additionally, various volatile components, such as benzene, toluene, and ethanol,
can be released during the thermal decomposition of materials like polystyrene,
ABS, and other resins, as seen in ICEV fires. Fire extinguishing water may also
become contaminated with harmful substances, including metals and halogens.
One significant risk associated with BEV fires is the potential for reignition after
the initial extinguishment. Reignition is dependent from residual stranded energy
and the internal pack temperature following the primary extinguishment. This
occurs when other cells within the battery pack, damaged during the initial event,
later enter thermal runaway. Such later reignitions have been observed during
real-world testing30 and pose challenges for firefighters in managing BEV fires
effectively.31 To address these challenges, some vehicle manufacturers are
developing new housing technologies that allow firefighters to directly access the
battery packs with fire suppressants, enhancing their ability to manage and
extinguish BEV fires safely.
3.1.2. Causes of battery fires
Batteries are more likely to catch fire when damaged. Four main categories of
factors can lead to fires as explained in the table below:
Cause of battery fire Explanation
Thermal abuse Thermal abuse in lithium-ion batteries occurs when external factors, like a nearby
fire, elevate temperatures. The first step is the decomposition of solid electrolyte
interphase (SEI) film and electrolyte occur at 80°C and 100°C respectively,
among which the chemical reactions between the negative electrode and the
electrolyte could occur as well.
30 Li-ion battery full scale thermal runaway test: environmental and personnel exposure influence
in case of rescue operations.
31 (Hynynen et al., 2023)
46Electrical abuse Electrical abuse happens when the current surpasses the maximum energy
storage limit, converting power into heat. If this heat is not dissipated fast, the
battery temperature rises, causing overheating and potentially leading to thermal
runaway. An over-current event like in short circuits generates excessive heat,
creating an electrically abusive situation that can lead to material decomposition.
Mechanical abuse Mechanical abuse happens when a battery undergoes physical damage, like
collisions or hitting obstacles. This can lead to various issues, with the most
common being a short-circuit. A short-circuit causes current to flow through the
conducting terminal, creating heat in the cell. If this heat is not dissipated quickly,
the battery cell can enter thermal runaway.
Flood damages Battery electric vehicles adhere to rigorous standards (UNECE Regulation n°100
- Revision 3, with amendments effective from 14 September 2017) to ensure
minimum protection against solid particles and water. However, damaged battery
packs, such as those from collisions, pose a risk, especially of saltwater entering
and potentially causing short-circuits between cells.
The speed at which thermal runaway propagates is intrinsically tied to the efficacy
of the chosen safety strategy and the materials used in the battery system.
Robust safety strategies at cell, module or pack level, including thermal
insulation, flame-retarding materials, and advanced cooling systems, significantly
slow down the propagation of thermal events. Additionally, State of Charge (SoC)
will play a big part on the thermal propagation.
3.2. Challenges and risks related to the recharging
infrastructure
Recharging infrastructure for BEVs involves several risks in the following
scenarios:
● Installations are not performed in compliance with applicable safety
regulations.
● The installer lacks proper qualifications for BEV charging installations.
● Electrical equipment used is unsuitable or unsafe.
● Maintenance or inspections are not conducted properly.
● Incidents of vandalism.
To better understand the challenges and risks associated with BEV recharging
infrastructure, it is essential to recognise that there are four distinct recharging
modes, each with its own fire risks. The table below provides a description of
these modes.
47Recharging Description Protection level
mode
Mode 1 ● Connection of an EV to a ● Non-dedicated power sockets
standard socket-outlet of an ● Simple cable
alternating current (AC) supply ● Risk of overheating
network by utilising a cable and ● No other residual current device than
plug. Both of which are not fitted that installed at the origin of the
with any supplementary pilot or installation, if any.
auxiliary contacts.
Note: Not allowed in the United States of
America, Israel, and the UK; prohibited for
public recharging in Italy; restricted in
Switzerland, Denmark, Norway, and
Germany.
Mode 2 Connection of a BEV to a standard socket- ● It should be set up with a new
outlet or a reinforced socket-outlet of an dedicated circuit and a dedicated
AC supply network utilising an AC BEV socket-outlets.
supply equipment with a cable and plug, ● Dedicated cable (IC-CPD) should
with a control pilot function and system for include control and safety functions.
personal protection against electric shock ● Setting of the IC-CPD current depends
placed between the standard plug and the on the national regulation.
EV. Typical portable / ""emergency"" ● IC-CPD includes residual current
charger. device, control of earthing continuity.
Note: Prohibited for public recharging in
Italy; restricted in the United States of
America, Canada, Switzerland, Denmark,
France, and Norway.
Mode 3 Connection of a BEV to an AC BEV supply ● Dedicated recharging infrastructure
equipment permanently connected to an incorporating charge and battery
AC supply network, with a control pilot temperature monitoring;
function that extends from the AC BEV ● Possible communication with parking
supply equipment to the BEV. lot supervision system and fire alarm
Note: It includes bidirectional system;
communication. Tethered (cable ● Dedicated cable.
permanently attached) and untethered
(dedicated socket outlet only)
configurations are available. This is a
typical public AC charger installation
mode.
Mode 4 Connection of a BEV to an AC or direct ● Dedicated power socket incorporating
current (DC) supply network utilising a DC charge monitoring;
BEV supply equipment, with a control pilot ● Dedicated cable;
function that extends from the DC BEV ● Residual current device included.
supply equipment to the BEV.
Note: This is a typical installation for “fast
charging”, “ultrafast charging”, “rapid
charging” and similar terms.
In addition to the elements listed in the table above, fire hazards related to BEV
recharging points can stem from short circuits, overloads, and over-currents. The
use of polymer flame-propagating materials in components like enclosures,
plugs, and sockets further contributes to this risk. However, these hazards can
be significantly mitigated by using non-flame-propagating products and installing
EV charging points in compliance with the relevant EN/HD and/or IEC
standards.32
32 (De Verschillende Technieken van Laden: Mode 1, 2, 3 En 4 | MobilityPlus (NL), 2018)
48Furthermore, charging Mode 2 may be utilised by an existing electrical
installation, where the vehicle is connected through a household socket via a
charging cable equipped with an In-Cable Control and Protection Device (IC-
CPD). During charging, a steady current flows over an extended period. The IC-
CPD limits the current, which may reach up to 20 A depending on the model.
Modern electrical installations typically design general-purpose socket circuits
with a maximum current of 16 A, ensuring that protections and conductors can
handle this safely. In installations adhering to wiring regulations, if the circuit
exceeds its design current, the overload protection device will activate to
safeguard the circuit. However, in non-compliant installations, protective devices
may fail to respond in time, and cables might suffer damage from prolonged
overloads. Supplying high currents over long durations in such installations poses
a serious fire risk. Although newer IC-CPD models (compliant with future EN IEC
62752 standards) include thermal monitoring to prevent overheating and manage
current flow, these safety features can be bypassed through the use of extension
cords, power boards, additional measurement devices, or travel adapters.
Another risk associated with recharging points is the lack of regular inspection
requirements for electrical installations, including recharging points, either at the
time of commissioning or as part of regular inspections.33 While some EU
Member States have specific requirements in this aspect, this is not a uniform
approach across the Union. The absence of inspections can lead to substandard
installations, particularly if recharging points are installed by unqualified
personnel, thereby increasing the risk of fire. With the growing demand for
recharging stations and a shortage of skilled workers, the pressure to deploy
installations rapidly is intensifying. This urgency can strain the workforce and
compromise the quality of installations. Proper training for installers is essential
to ensure compliance with safety and electrical standards. Recharging points
should only be installed by professionals with adequate qualifications, not by
individuals who have received minimal training through short courses or lack
official certifications. Reliance on underqualified workers increases the likelihood
of improper installation, posing risks to both the workers and the recharging
infrastructure.34
While the risk of fires during the installation of recharging stations is relatively low,
electrical safety risks for workers remain a concern. These risks, closely linked to
fire hazards, can arise from poor installation practices. In Europe, nearly 47% of
accidental residential fires are caused by electrical issues.35 Improperly installed
recharging stations, particularly those connected to building or grid electrical
systems by unqualified workers, heighten fire risks. Even after the initial
33 (Hynynen et al., 2023)
34 (McGlone, 2022)
35 (White Paper: Accidental Electrical Domestic Fires, 2021)
49installation, electrical safety concerns can emerge over time. These issues might
result from equipment wear and tear or user interference with the system. Such
risks are more pronounced when recharging points and their electrical
installations are not regularly inspected and maintained. 36 It is crucial that
operators of recharging stations conduct maintenance and inspections using fully
qualified personnel. Regular checks help mitigate risks associated with aging
equipment and ensure the long-term safety of the installation.
3.3. Challenges and risks related to human safety and
firefighters intervening on the scene
As with any type of vehicle fire in enclosed spaces, especially in residential
buildings, BEV fires can pose significant threats to human life, including the safety
of emergency responders on the scene. Fires can quickly spread between
vehicles—both ICEVs and BEVs—potentially trapping individuals in parking
areas with smoke or flames, leading to casualties. Vehicle fires, regardless of
whether they involve ICEVs or BEVs, release toxic gases and substances.
Even though BEV fires do not inherently carry an aggregated risk of toxic gas
emissions, fires, including those involving BEVs, produce various gases that can
irritate airways and cause corrosion, such as hydrogen chloride, sulphur dioxide,
and hydrogen fluoride (HF). HF is not exclusive to BEV fires; it is also released in
fires involving fluoride-containing products commonly found in ICEV fires and
household polymers. In fact, HF is present in almost all house fires, posing a
longstanding risk to fire services. Exposure to HF and hydrofluoric acid can occur
through inhalation or skin absorption. Inhaling fire smoke, including HF gas, can
cause severe lung damage and impair oxygen absorption.
Similarly, combustion gases from any vehicle fire are toxic and can lead to
incapacitation. Carbon monoxide (CO) and hydrogen cyanide (HCN) are
common causes of death in fire incidents involving smoke inhalation.37 CO, in
particular, is the dominant toxicant in such scenarios as it forms whenever organic
materials burn. Halogen-containing materials, such as brominated flame
retardants, are more challenging to ignite and burn more slowly than non-
halogenated equivalents. This slower burning rate can result in a reduced release
of gaseous combustion products, especially if delayed ignition or rapid self-
extinguishment occurs.38
When responding to BEV fires, emergency personnel, especially firefighters,
must employ distinct strategies compared to ICEV fires, particularly if the BEV's
36 (White Paper: Accidental Electrical Domestic Fires, 2021)
37 (Eckstein & Maniscalco, 2006)
38 (Sergei Levchik et al., 2011, p. 240)
50battery pack enters thermal runaway. Despite differences, there are significant
design similarities between BEVs and ICEVs, which pose similar risks for
firefighters in enclosed parking areas due to the increased flammability and toxic
vapours released by modern vehicles with more combustible materials. In BEV
fires involving the battery pack, additional gases are released from the burning
electrolyte and lithium-ion salts. Studies, such as those by Lam et al., suggest
that while ICEV fires typically have a single peak heat release rate (HRR) followed
by a steady decline, BEV fires often exhibit two peaks: one when combustible
materials ignite and another when the battery becomes involved. Research by
Kang et al. further indicates that BEV fires may have slightly lower peak heat
release rates (pHRR) and total heat release than their ICEV counterparts.39 For
BEV fires, the primary heat contribution comes from the combustion of
conventional body materials rather than the battery pack itself. However, thermal
runaway in the battery can produce a jet fire, accelerating the spread to nearby
combustible components and the rest of the vehicle.
Firefighters must carefully evaluate each fire situation to choose the most
appropriate methods, tactics, and technologies, as strategies for addressing BEV
fires continue to evolve. To ensure safety during vehicle fire interventions,
firefighters may use towing equipment to move vehicles into open-air
environments, but this is only feasible if the vehicle is not in thermal runaway.
Such operations depend on factors like visibility, temperature conditions, and the
management of re-ignition risks. Additionally, the combination of lithium and
water can produce combustible hydrogen, further complicating firefighting efforts.
Maintaining a safe distance and wearing protective equipment, such as 1,000-
volt gloves, is critical near batteries and high-voltage circuits. Contact with live
cables carrying high DC voltages in EVs can result in fatal electrocution, with
injury severity depending on factors like current intensity, voltage, the conductive
path, and exposure duration. Even when a fire appears to be under control, risks
such as liquid splashes, spontaneous reignition, and explosions remain.
Reignition, often signalled by white smoke without a significant temperature
increase, can occur suddenly, while explosions can create dangerous missile
effects. Furthermore, upon arrival, firefighters may lack crucial information about
the vehicles involved or the presence of thermal runaway, making it harder to
formulate an effective attack strategy.
39 (Kang et al., 2023)
513.4. Challenges and risks for parking operators and
building owners
As BEVs become increasingly common on European roads, parking lot operators
and building owners must prioritise fire safety by providing essential services
such as parking facilities and recharging infrastructure for BEVs. A key concern
for these stakeholders is ensuring the safe parking of both BEVs and ICEVs,
particularly in enclosed spaces beneath or adjacent to buildings. This is vital to
ensuring public safety. Accommodating BEVs presents unique challenges for
parking operators and building owners, especially given the diversity in building
construction and design. Establishing consistent fire safety standards for both
new and existing structures is difficult, as some preventive measures are not
feasible in existing buildings. The increasing size of vehicles of both ICEVs and
BEVs further exacerbates the issue, reducing available space and increasing the
risk of fire spread and structural damage. Moreover, the use of proper recharging
infrastructure is critical. In the absence of designated recharging stations, BEV
drivers may resort to non-compliant equipment, which can significantly elevate
fire risks.40 Addressing these challenges, along with implementing necessary fire
prevention measures, places financial burden on operators and building owners
as they adapt to the evolving automotive landscape.
3.5. Challenges and risks for insurers
The mission of the insurance industry is to provide consumers and businesses
with protection against adverse events, such as a fire in a parking garage.
Consequently, improving the fire safety of BEVs in covered parking spaces is
highly relevant to the insurers. Furthermore, since the risks and losses from a
battery fire are not confined to the BEVs itself but can escalate, causing
significant property damage, loss of life, and serious injuries, insurers across
Europe are assessing how the growing electrification of mobility may impact their
ability to offer affordable risk protection. Although current data and research on
this evolving risk landscape remain limited, existing studies offer valuable insights
and direction for further action, particularly regarding BEVs in covered garages.
One such study, conducted by VdS Schadenverhütung and the German
Insurance Association examines the fire risks associated with BEVs parked in
enclosed medium- and large-sized garages. The findings emphasise that fire
risks are inherently higher in enclosed parking spaces, primarily due to the
release of extreme heat and smoke gases—regardless of whether the vehicle is
electric or powered by a traditional combustion engine. Additionally, there are
risks tied to recharging infrastructure for BEVs, the recharging process, and
40 (Hynynen et al., 2023)
52potentially defective or damaged vehicle battery systems. According to a study
by reinsurer Swiss Re41, fire safety risks may arise when multiple vehicles are
recharging simultaneously or queuing to use recharging facilities in confined
spaces, such as office parking garages, residential building lots, or
commercial/retail premises. Issues with recharging infrastructure can lead to
third-party property damage and liability claims, underscoring the need for
tailored risk prevention and management strategies.42
3.6. Risks for the environment
This final section addresses the environmental risks associated with fires
involving BEVs. BEVs possess unique characteristics due to their batteries and
associated components. However, it is important to emphasise that, aside from
the battery, the environmental impact of BEV fires is largely comparable to that
of ICEV fires. Both types of fires emit toxic fumes, contaminate firefighting water,
pollute rainwater and soil, and endanger surrounding plant and animal life. The
table below outlines the primary risks associated with BEV fires and specifies
whether these risks are unique to them or not.
Environmental Description Inherent to BEVs (Yes / No)
Impact
Categories
Air pollution / ● Metal Oxides: Lithium-ion batteries No.
Toxic contain various metals, such as cobalt, ● These types of emissions
emissions nickel, and manganese. When they burn, are inherent to all types of
these substances can be oxidised and vehicles burning whether
released into the air as fine particles. ICE or BEV. However, HF
These metal oxides are harmful when has been detected in
inhaled and can cause respiratory higher quantities in BEV
problems. fires than in ICEV fires.
● Carbon Dioxide (CO2): Although less During the fire
toxic than other emissions, CO2 is a extinguishing, water spray
greenhouse gas that contributes to global cooling used in conjunction
warming. Its release in large quantities with halogenated
can have a negative environmental extinguishants reduces the
impact. peak HF concentration and
● Volatile Organic Compounds (VOCs): the decay time.
These compounds can be emitted during
the combustion of polymer materials and
other organic components of the vehicle.
VOCs can include substances such as
